fd_tvm/logs/darknet/fd_light/fd_light.tune.log
{"input": ["cuda", "conv2d_nchw.cuda", [["TENSOR", [1, 512, 13, 13], "float32"], ["TENSOR", [18, 512, 1, 1], "float32"], [1, 1], [0, 0, 0, 0], [1, 1], "float32"], {}], "config": {"index": 30417, "code_hash": null, "entity": [["tile_f", "sp", [-1, 1, 18, 1]], ["tile_y", "sp", [-1, 1, 1, 1]], ["tile_x", "sp", [-1, 1, 13, 1]], ["tile_rc", "sp", [-1, 128]], ["tile_ry", "sp", [-1, 1]], ["tile_rx", "sp", [-1, 1]], ["auto_unroll_max_step", "ot", 512], ["unroll_explicit", "ot", 1]]}, "result": [[9.615146175752645e-06], 0, 1.4005968570709229, 1588397286.2824104], "version": 0.2, "tvm_version": "0.7.dev1"}
{"input": ["cuda", "conv2d_nchw_winograd.cuda", [["TENSOR", [1, 3, 416, 416], "float32"], ["TENSOR", [16, 3, 3, 3], "float32"], [1, 1], [1, 1, 1, 1], [1, 1], "float32"], {}], "config": {"index": 151206, "code_hash": null, "entity": [["tile_b", "sp", [-1, 1, 1, 1]], ["tile_y", "sp", [-1, 2, 2, 1]], ["tile_x", "sp", [-1, 1, 104, 1]], ["tile_rc", "sp", [-1, 3]], ["auto_unroll_max_step", "ot", 1500], ["unroll_explicit", "ot", 0]]}, "result": [[0.0003685652073170732], 0, 3.0164411067962646, 1588399052.1290896], "version": 0.2, "tvm_version": "0.7.dev1"}
{"input": ["cuda", "conv2d_nchw.cuda", [["TENSOR", [1, 3, 416, 416], "float32"], ["TENSOR", [16, 3, 3, 3], "float32"], [1, 1], [1, 1, 1, 1], [1, 1], "float32"], {}], "config": {"index": 41146899, "code_hash": null, "entity": [["tile_f", "sp", [-1, 1, 8, 2]], ["tile_y", "sp", [-1, 1, 2, 2]], ["tile_x", "sp", [-1, 1, 16, 2]], ["tile_rc", "sp", [-1, 3]], ["tile_ry", "sp", [-1, 3]], ["tile_rx", "sp", [-1, 3]], ["auto_unroll_max_step", "ot", 1500], ["unroll_explicit", "ot", 0]]}, "result": [[7.24464302213667e-05], 0, 1.0570850372314453, 1588403796.7227833], "version": 0.2, "tvm_version": "0.7.dev1"}
{"input": ["cuda", "conv2d_nchw.cuda", [["TENSOR", [1, 16, 416, 416], "float32"], ["TENSOR", [32, 16, 3, 3], "float32"], [2, 2], [1, 1, 1, 1], [1, 1], "float32"], {}], "config": {"index": 61928793, "code_hash": null, "entity": [["tile_f", "sp", [-1, 4, 8, 1]], ["tile_y", "sp", [-1, 2, 2, 1]], ["tile_x", "sp", [-1, 1, 4, 2]], ["tile_rc", "sp", [-1, 2]], ["tile_ry", "sp", [-1, 3]], ["tile_rx", "sp", [-1, 3]], ["auto_unroll_max_step", "ot", 1500], ["unroll_explicit", "ot", 0]]}, "result": [[0.00016913079413817167], 0, 1.5259554386138916, 1588406199.3341348], "version": 0.2, "tvm_version": "0.7.dev1"}
{"input": ["cuda", "conv2d_nchw.cuda", [["TENSOR", [1, 32, 208, 208], "float32"], ["TENSOR", [16, 32, 1, 1], "float32"], [1, 1], [0, 0, 0, 0], [1, 1], "float32"], {}], "config": {"index": 22800096, "code_hash": null, "entity": [["tile_f", "sp", [-1, 4, 4, 1]], ["tile_y", "sp", [-1, 2, 2, 1]], ["tile_x", "sp", [-1, 1, 16, 1]], ["tile_rc", "sp", [-1, 8]], ["tile_ry", "sp", [-1, 1]], ["tile_rx", "sp", [-1, 1]], ["auto_unroll_max_step", "ot", 1500], ["unroll_explicit", "ot", 1]]}, "result": [[4.1852406958629046e-05], 0, 1.6031253337860107, 1588408367.144892], "version": 0.2, "tvm_version": "0.7.dev1"}
{"input": ["cuda", "conv2d_nchw_winograd.cuda", [["TENSOR", [1, 16, 208, 208], "float32"], ["TENSOR", [32, 16, 3, 3], "float32"], [1, 1], [1, 1, 1, 1], [1, 1], "float32"], {}], "config": {"index": 375972, "code_hash": null, "entity": [["tile_b", "sp", [-1, 1, 1, 1]], ["tile_y", "sp", [-1, 2, 4, 4]], ["tile_x", "sp", [-1, 1, 52, 1]], ["tile_rc", "sp", [-1, 16]], ["auto_unroll_max_step", "ot", 0], ["unroll_explicit", "ot", 1]]}, "result": [[0.0002395467628968254], 0, 2.6608567237854004, 1588410385.4222646], "version": 0.2, "tvm_version": "0.7.dev1"}
{"input": ["cuda", "conv2d_nchw.cuda", [["TENSOR", [1, 16, 208, 208], "float32"], ["TENSOR", [32, 16, 3, 3], "float32"], [1, 1], [1, 1, 1, 1], [1, 1], "float32"], {}], "config": {"index": 106728597, "code_hash": null, "entity": [["tile_f", "sp", [-1, 1, 8, 4]], ["tile_y", "sp", [-1, 4, 1, 2]], ["tile_x", "sp", [-1, 1, 16, 1]], ["tile_rc", "sp", [-1, 4]], ["tile_ry", "sp", [-1, 3]], ["tile_rx", "sp", [-1, 3]], ["auto_unroll_max_step", "ot", 512], ["unroll_explicit", "ot", 1]]}, "result": [[9.336954258188825e-05], 0, 1.6385629177093506, 1588413749.5727262], "version": 0.2, "tvm_version": "0.7.dev1"}
{"input": ["cuda", "conv2d_nchw.cuda", [["TENSOR", [1, 32, 104, 104], "float32"], ["TENSOR", [32, 32, 1, 1], "float32"], [1, 1], [0, 0, 0, 0], [1, 1], "float32"], {}], "config": {"index": 488373, "code_hash": null, "entity": [["tile_f", "sp", [-1, 2, 1, 16]], ["tile_y", "sp", [-1, 1, 1, 1]], ["tile_x", "sp", [-1, 1, 104, 1]], ["tile_rc", "sp", [-1, 2]], ["tile_ry", "sp", [-1, 1]], ["tile_rx", "sp", [-1, 1]], ["auto_unroll_max_step", "ot", 0], ["unroll_explicit", "ot", 0]]}, "result": [[1.4616341664629674e-05], 0, 1.5230145454406738, 1588418010.735132], "version": 0.2, "tvm_version": "0.7.dev1"}
{"input": ["cuda", "conv2d_nchw_winograd.cuda", [["TENSOR", [1, 32, 104, 104], "float32"], ["TENSOR", [64, 32, 3, 3], "float32"], [1, 1], [1, 1, 1, 1], [1, 1], "float32"], {}], "config": {"index": 296144, "code_hash": null, "entity": [["tile_b", "sp", [-1, 1, 1, 1]], ["tile_y", "sp", [-1, 2, 8, 2]], ["tile_x", "sp", [-1, 2, 26, 1]], ["tile_rc", "sp", [-1, 32]], ["auto_unroll_max_step", "ot", 1500], ["unroll_explicit", "ot", 1]]}, "result": [[0.0001316614181977253], 0, 2.77889347076416, 1588419737.905959], "version": 0.2, "tvm_version": "0.7.dev1"}
{"input": ["cuda", "conv2d_nchw.cuda", [["TENSOR", [1, 32, 104, 104], "float32"], ["TENSOR", [64, 32, 3, 3], "float32"], [1, 1], [1, 1, 1, 1], [1, 1], "float32"], {}], "config": {"index": 36288278, "code_hash": null, "entity": [["tile_f", "sp", [-1, 2, 32, 1]], ["tile_y", "sp", [-1, 8, 1, 1]], ["tile_x", "sp", [-1, 1, 4, 2]], ["tile_rc", "sp", [-1, 2]], ["tile_ry", "sp", [-1, 3]], ["tile_rx", "sp", [-1, 3]], ["auto_unroll_max_step", "ot", 1500], ["unroll_explicit", "ot", 0]]}, "result": [[9.068917272386662e-05], 0, 1.5557441711425781, 1588423126.0649278], "version": 0.2, "tvm_version": "0.7.dev1"}
{"input": ["cuda", "conv2d_nchw.cuda", [["TENSOR", [1, 64, 52, 52], "float32"], ["TENSOR", [64, 64, 1, 1], "float32"], [1, 1], [0, 0, 0, 0], [1, 1], "float32"], {}], "config": {"index": 5143346, "code_hash": null, "entity": [["tile_f", "sp", [-1, 2, 32, 1]], ["tile_y", "sp", [-1, 1, 1, 13]], ["tile_x", "sp", [-1, 1, 4, 1]], ["tile_rc", "sp", [-1, 8]], ["tile_ry", "sp", [-1, 1]], ["tile_rx", "sp", [-1, 1]], ["auto_unroll_max_step", "ot", 1500], ["unroll_explicit", "ot", 1]]}, "result": [[1.3444420304568527e-05], 0, 1.540550947189331, 1588426449.9434242], "version": 0.2, "tvm_version": "0.7.dev1"}
{"input": ["cuda", "conv2d_nchw.cuda", [["TENSOR", [1, 128, 52, 52], "float32"], ["TENSOR", [64, 128, 1, 1], "float32"], [1, 1], [0, 0, 0, 0], [1, 1], "float32"], {}], "config": {"index": 4891089, "code_hash": null, "entity": [["tile_f", "sp", [-1, 8, 8, 1]], ["tile_y", "sp", [-1, 1, 1, 4]], ["tile_x", "sp", [-1, 1, 26, 1]], ["tile_rc", "sp", [-1, 16]], ["tile_ry", "sp", [-1, 1]], ["tile_rx", "sp", [-1, 1]], ["auto_unroll_max_step", "ot", 512], ["unroll_explicit", "ot", 1]]}, "result": [[1.9225183614224658e-05], 0, 1.7675485610961914, 1588429403.857744], "version": 0.2, "tvm_version": "0.7.dev1"}
{"input": ["cuda", "conv2d_nchw_winograd.cuda", [["TENSOR", [1, 64, 52, 52], "float32"], ["TENSOR", [128, 64, 3, 3], "float32"], [1, 1], [1, 1, 1, 1], [1, 1], "float32"], {}], "config": {"index": 51057, "code_hash": null, "entity": [["tile_b", "sp", [-1, 1, 1, 1]], ["tile_y", "sp", [-1, 8, 8, 2]], ["tile_x", "sp", [-1, 2, 26, 1]], ["tile_rc", "sp", [-1, 16]], ["auto_unroll_max_step", "ot", 0], ["unroll_explicit", "ot", 0]]}, "result": [[0.00011469215179252479], 0, 1.147158145904541, 1588431375.5984898], "version": 0.2, "tvm_version": "0.7.dev1"}
{"input": ["cuda", "conv2d_nchw.cuda", [["TENSOR", [1, 64, 52, 52], "float32"], ["TENSOR", [128, 64, 3, 3], "float32"], [1, 1], [1, 1, 1, 1], [1, 1], "float32"], {}], "config": {"index": 25779631, "code_hash": null, "entity": [["tile_f", "sp", [-1, 2, 32, 1]], ["tile_y", "sp", [-1, 1, 1, 13]], ["tile_x", "sp", [-1, 1, 4, 1]], ["tile_rc", "sp", [-1, 2]], ["tile_ry", "sp", [-1, 3]], ["tile_rx", "sp", [-1, 3]], ["auto_unroll_max_step", "ot", 512], ["unroll_explicit", "ot", 1]]}, "result": [[9.029524525493115e-05], 0, 1.7871196269989014, 1588433334.5355387], "version": 0.2, "tvm_version": "0.7.dev1"}
{"input": ["cuda", "conv2d_nchw.cuda", [["TENSOR", [1, 128, 26, 26], "float32"], ["TENSOR", [128, 128, 1, 1], "float32"], [1, 1], [0, 0, 0, 0], [1, 1], "float32"], {}], "config": {"index": 630863, "code_hash": null, "entity": [["tile_f", "sp", [-1, 4, 8, 1]], ["tile_y", "sp", [-1, 1, 1, 2]], ["tile_x", "sp", [-1, 1, 26, 1]], ["tile_rc", "sp", [-1, 16]], ["tile_ry", "sp", [-1, 1]], ["tile_rx", "sp", [-1, 1]], ["auto_unroll_max_step", "ot", 1500], ["unroll_explicit", "ot", 0]]}, "result": [[1.1921162307380374e-05], 0, 1.6033046245574951, 1588435178.664201], "version": 0.2, "tvm_version": "0.7.dev1"}
{"input": ["cuda", "conv2d_nchw.cuda", [["TENSOR", [1, 256, 26, 26], "float32"], ["TENSOR", [128, 256, 1, 1], "float32"], [1, 1], [0, 0, 0, 0], [1, 1], "float32"], {}], "config": {"index": 967818, "code_hash": null, "entity": [["tile_f", "sp", [-1, 8, 4, 1]], ["tile_y", "sp", [-1, 2, 1, 1]], ["tile_x", "sp", [-1, 1, 26, 1]], ["tile_rc", "sp", [-1, 16]], ["tile_ry", "sp", [-1, 1]], ["tile_rx", "sp", [-1, 1]], ["auto_unroll_max_step", "ot", 0], ["unroll_explicit", "ot", 1]]}, "result": [[2.3104837407726967e-05], 0, 1.4923429489135742, 1588436655.7814817], "version": 0.2, "tvm_version": "0.7.dev1"}
{"input": ["cuda", "conv2d_nchw_winograd.cuda", [["TENSOR", [1, 128, 26, 26], "float32"], ["TENSOR", [256, 128, 3, 3], "float32"], [1, 1], [1, 1, 1, 1], [1, 1], "float32"], {}], "config": {"index": 60159, "code_hash": null, "entity": [["tile_b", "sp", [-1, 1, 1, 1]], ["tile_y", "sp", [-1, 1, 8, 4]], ["tile_x", "sp", [-1, 13, 13, 1]], ["tile_rc", "sp", [-1, 16]], ["auto_unroll_max_step", "ot", 128], ["unroll_explicit", "ot", 1]]}, "result": [[9.032246101949025e-05], 0, 1.6241366863250732, 1588438143.128482], "version": 0.2, "tvm_version": "0.7.dev1"}
{"input": ["cuda", "conv2d_nchw.cuda", [["TENSOR", [1, 128, 26, 26], "float32"], ["TENSOR", [256, 128, 3, 3], "float32"], [1, 1], [1, 1, 1, 1], [1, 1], "float32"], {}], "config": {"index": 6467709, "code_hash": null, "entity": [["tile_f", "sp", [-1, 1, 64, 1]], ["tile_y", "sp", [-1, 1, 2, 13]], ["tile_x", "sp", [-1, 2, 1, 1]], ["tile_rc", "sp", [-1, 2]], ["tile_ry", "sp", [-1, 3]], ["tile_rx", "sp", [-1, 3]], ["auto_unroll_max_step", "ot", 512], ["unroll_explicit", "ot", 1]]}, "result": [[0.00010323987914893618], 0, 1.6900417804718018, 1588439598.8641706], "version": 0.2, "tvm_version": "0.7.dev1"}
{"input": ["cuda", "conv2d_nchw.cuda", [["TENSOR", [1, 256, 13, 13], "float32"], ["TENSOR", [256, 256, 1, 1], "float32"], [1, 1], [0, 0, 0, 0], [1, 1], "float32"], {}], "config": {"index": 83186, "code_hash": null, "entity": [["tile_f", "sp", [-1, 4, 8, 1]], ["tile_y", "sp", [-1, 1, 1, 1]], ["tile_x", "sp", [-1, 1, 13, 1]], ["tile_rc", "sp", [-1, 16]], ["tile_ry", "sp", [-1, 1]], ["tile_rx", "sp", [-1, 1]], ["auto_unroll_max_step", "ot", 0], ["unroll_explicit", "ot", 1]]}, "result": [[2.4062762350337058e-05], 0, 1.4882712364196777, 1588441238.6285775], "version": 0.2, "tvm_version": "0.7.dev1"}
{"input": ["cuda", "conv2d_nchw_winograd.cuda", [["TENSOR", [1, 256, 13, 13], "float32"], ["TENSOR", [512, 256, 3, 3], "float32"], [1, 1], [1, 1, 1, 1], [1, 1], "float32"], {}], "config": {"index": 106607, "code_hash": null, "entity": [["tile_b", "sp", [-1, 1, 1, 1]], ["tile_y", "sp", [-1, 2, 16, 4]], ["tile_x", "sp", [-1, 7, 7, 1]], ["tile_rc", "sp", [-1, 8]], ["auto_unroll_max_step", "ot", 1500], ["unroll_explicit", "ot", 1]]}, "result": [[8.553094615657102e-05], 0, 1.85038161277771, 1588442564.9284756], "version": 0.2, "tvm_version": "0.7.dev1"}
{"input": ["cuda", "conv2d_nchw.cuda", [["TENSOR", [1, 256, 13, 13], "float32"], ["TENSOR", [512, 256, 3, 3], "float32"], [1, 1], [1, 1, 1, 1], [1, 1], "float32"], {}], "config": {"index": 356874, "code_hash": null, "entity": [["tile_f", "sp", [-1, 1, 16, 1]], ["tile_y", "sp", [-1, 1, 13, 1]], ["tile_x", "sp", [-1, 13, 1, 1]], ["tile_rc", "sp", [-1, 4]], ["tile_ry", "sp", [-1, 3]], ["tile_rx", "sp", [-1, 3]], ["auto_unroll_max_step", "ot", 1500], ["unroll_explicit", "ot", 0]]}, "result": [[0.0002028554158995816], 0, 1.5491101741790771, 1588445057.9389102], "version": 0.2, "tvm_version": "0.7.dev1"}
{"input": ["cuda", "conv2d_nchw_winograd.cuda", [["TENSOR", [1, 512, 13, 13], "float32"], ["TENSOR", [1024, 512, 3, 3], "float32"], [1, 1], [1, 1, 1, 1], [1, 1], "float32"], {}], "config": {"index": 152876, "code_hash": null, "entity": [["tile_b", "sp", [-1, 1, 1, 1]], ["tile_y", "sp", [-1, 2, 16, 4]], ["tile_x", "sp", [-1, 7, 7, 1]], ["tile_rc", "sp", [-1, 8]], ["auto_unroll_max_step", "ot", 1500], ["unroll_explicit", "ot", 1]]}, "result": [[0.0002737240406779661], 0, 1.8803768157958984, 1588446007.130054], "version": 0.2, "tvm_version": "0.7.dev1"}
{"input": ["cuda", "conv2d_nchw.cuda", [["TENSOR", [1, 512, 13, 13], "float32"], ["TENSOR", [1024, 512, 3, 3], "float32"], [1, 1], [1, 1, 1, 1], [1, 1], "float32"], {}], "config": {"index": 1024545, "code_hash": null, "entity": [["tile_f", "sp", [-1, 1, 8, 2]], ["tile_y", "sp", [-1, 1, 13, 1]], ["tile_x", "sp", [-1, 1, 1, 13]], ["tile_rc", "sp", [-1, 8]], ["tile_ry", "sp", [-1, 1]], ["tile_rx", "sp", [-1, 3]], ["auto_unroll_max_step", "ot", 1500], ["unroll_explicit", "ot", 1]]}, "result": [[0.0004948962346938775], 0, 1.9046826362609863, 1588447592.2638574], "version": 0.2, "tvm_version": "0.7.dev1"}
{"input": ["cuda", "conv2d_nchw.cuda", [["TENSOR", [1, 1024, 13, 13], "float32"], ["TENSOR", [256, 1024, 1, 1], "float32"], [1, 1], [0, 0, 0, 0], [1, 1], "float32"], {}], "config": {"index": 157106, "code_hash": null, "entity": [["tile_f", "sp", [-1, 4, 8, 1]], ["tile_y", "sp", [-1, 1, 1, 1]], ["tile_x", "sp", [-1, 1, 13, 1]], ["tile_rc", "sp", [-1, 16]], ["tile_ry", "sp", [-1, 1]], ["tile_rx", "sp", [-1, 1]], ["auto_unroll_max_step", "ot", 1500], ["unroll_explicit", "ot", 1]]}, "result": [[9.091257835400225e-05], 0, 1.4341075420379639, 1588448714.6543605], "version": 0.2, "tvm_version": "0.7.dev1"}
{"input": ["cuda", "conv2d_nchw.cuda", [["TENSOR", [1, 256, 13, 13], "float32"], ["TENSOR", [128, 256, 1, 1], "float32"], [1, 1], [0, 0, 0, 0], [1, 1], "float32"], {}], "config": {"index": 95063, "code_hash": null, "entity": [["tile_f", "sp", [-1, 4, 8, 1]], ["tile_y", "sp", [-1, 1, 1, 1]], ["tile_x", "sp", [-1, 1, 13, 1]], ["tile_rc", "sp", [-1, 16]], ["tile_ry", "sp", [-1, 1]], ["tile_rx", "sp", [-1, 1]], ["auto_unroll_max_step", "ot", 1500], ["unroll_explicit", "ot", 1]]}, "result": [[1.491008105578435e-05], 0, 1.983722448348999, 1588449995.5691123], "version": 0.2, "tvm_version": "0.7.dev1"}
{"input": ["cuda", "conv2d_nchw_winograd.cuda", [["TENSOR", [1, 384, 26, 26], "float32"], ["TENSOR", [256, 384, 3, 3], "float32"], [1, 1], [1, 1, 1, 1], [1, 1], "float32"], {}], "config": {"index": 117909, "code_hash": null, "entity": [["tile_b", "sp", [-1, 1, 1, 1]], ["tile_y", "sp", [-1, 1, 8, 4]], ["tile_x", "sp", [-1, 13, 13, 1]], ["tile_rc", "sp", [-1, 16]], ["auto_unroll_max_step", "ot", 128], ["unroll_explicit", "ot", 1]]}, "result": [[0.0002142397817403709], 0, 1.2303509712219238, 1588451033.218285], "version": 0.2, "tvm_version": "0.7.dev1"}
{"input": ["cuda", "conv2d_nchw.cuda", [["TENSOR", [1, 384, 26, 26], "float32"], ["TENSOR", [256, 384, 3, 3], "float32"], [1, 1], [1, 1, 1, 1], [1, 1], "float32"], {}], "config": {"index": 7514166, "code_hash": null, "entity": [["tile_f", "sp", [-1, 1, 8, 2]], ["tile_y", "sp", [-1, 1, 2, 1]], ["tile_x", "sp", [-1, 1, 2, 13]], ["tile_rc", "sp", [-1, 2]], ["tile_ry", "sp", [-1, 3]], ["tile_rx", "sp", [-1, 3]], ["auto_unroll_max_step", "ot", 1500], ["unroll_explicit", "ot", 0]]}, "result": [[0.0002649981005291006], 0, 1.115598440170288, 1588453498.7027678], "version": 0.2, "tvm_version": "0.7.dev1"}
{"input": ["cuda", "conv2d_nchw.cuda", [["TENSOR", [1, 256, 26, 26], "float32"], ["TENSOR", [18, 256, 1, 1], "float32"], [1, 1], [0, 0, 0, 0], [1, 1], "float32"], {}], "config": {"index": 343416, "code_hash": null, "entity": [["tile_f", "sp", [-1, 2, 9, 1]], ["tile_y", "sp", [-1, 1, 1, 2]], ["tile_x", "sp", [-1, 1, 26, 1]], ["tile_rc", "sp", [-1, 64]], ["tile_ry", "sp", [-1, 1]], ["tile_rx", "sp", [-1, 1]], ["auto_unroll_max_step", "ot", 0], ["unroll_explicit", "ot", 1]]}, "result": [[9.024392106474379e-06], 0, 1.4275472164154053, 1588455836.7185092], "version": 0.2, "tvm_version": "0.7.dev1"}
